{
  "manifestVersion": 1,
  "profile": "reactor-6-static",
  "description": "Curated .NET Reactor 6 corpus. Binary samples remain outside git. One entry is not a .NET file at all: windowsmanagement-bootstrap is a native stub whose only gate is the hash of the assembly decrypted out of it, because a substitution table built slightly wrong still produces bytes and only the hash says whether they are the right ones. The assembly it yields is itself the qbjuef-family stub, so the two entries together cover the whole chain. rrdsk-payload is the detection boundary: a string resolver, its dispatchers and two encrypted resources are the least a build can show and still be recognised, and they add up to exactly the confidence the gate asks for. It is here because that sum was once computed a fraction under the gate, which left the sample reported as unprotected and its recovery thrown away, so this entry fails if the gate moves or its arithmetic drifts again.",
  "samples": [
    {
      "id": "mlfhntkcvb",
      "tier": "profiled",
      "sha256": "ad0c3182b18b5d7ba8771d830f4d51b4ada7e26f8d05223f4379e6312aba65fa",
      "localName": "embedded_dotnet_Mlfhntkcvb.exe",
      "expectedDetection": "reactor",
      "expectedCapabilities": ["delegate-proxy", "resource-container", "protected-strings"],
      "oracleSha256": null,
      "minimumVirtualOperationsRead": 1.0,
      "minimumVirtualOperationsWalked": 0.998,
      "requireConsistentVirtualStack": true
    },
    {
      "id": "qafcakg",
      "tier": "profiled",
      "sha256": "c405398fc582e33bbbd37222b7360a6cfdc526146622141503de1ccf9de6174a",
      "localName": "embedded_dotnet_Qafcakg.exe",
      "expectedDetection": "reactor",
      "expectedCapabilities": ["delegate-proxy", "resource-container", "protected-strings"],
      "oracleSha256": null,
      "minimumVirtualOperationsRead": 1.0,
      "minimumVirtualOperationsWalked": 0.995,
      "requireConsistentVirtualStack": true
    },
    {
      "id": "qbjuef",
      "tier": "profiled",
      "sha256": "c8fab65dedd9c62a35cfab7e318225c42cc838d57fe0a1f072b195a1a779523b",
      "localName": "Qbjuef.exe",
      "expectedDetection": "reactor",
      "expectedCapabilities": ["delegate-proxy", "resource-container", "protected-strings", "dispatcher-control-flow", "virtualization"],
      "oracleSha256": null,
      "maximumRemainingStubs": 0,
      "minimumStringSiteCoverage": 1.0,
      "minimumVirtualOperationsRead": 1.0,
      "minimumVirtualOperationsWalked": 0.998,
      "requireConsistentVirtualStack": true,
      "expectedPayloadSha256": [
        "bb8fb1ca76cb531bdbedcdafa851b5de6e86042350e7cc5cb121c0fe4f23ca2b",
        "417032e561fe410a246fea4f580b7ae8de4a8cc5098a508931a78322916199dd"
      ]
    },
    {
      "id": "reason-pac",
      "tier": "detected",
      "sha256": "8266fb6626cb3ad88b3cb7d5d5542a530b38230445af7ff76d102f8c49129b16",
      "localName": "Reason.PAC.dll",
      "expectedDetection": "reactor",
      "expectedCapabilities": ["method-stubs", "jit-hook", "protected-strings", "dispatcher-control-flow", "anti-tamper"],
      "oracleSha256": "82d2b678896ebb388c4ef9ea877e898d1ac2907d956deec4035faddda847dec0",
      "expectedRestoredBodyCount": 312,
      "maximumRemainingStubs": 0,
      "minimumStringSiteCoverage": 1.0,
      "maximumMutationCount": 20000,
      "requireOracleParity": true,
      "maximumSurplusMethods": -99,
      "maximumProgramMethodSurplus": 16,
      "maximumSurplusResources": 3,
      "requireOracleResourceParity": true
    },
    {
      "id": "service-controller",
      "tier": "detected",
      "sha256": "15931d5e8c20547c24c851dcb2e29b747699e8b81b925c46c2245269c93d1c91",
      "localName": "rsServiceController.dll",
      "expectedDetection": "reactor",
      "expectedCapabilities": ["method-stubs", "jit-hook", "protected-strings", "dispatcher-control-flow", "anti-tamper"],
      "oracleSha256": "6cdf18c01fe19595d44022a587b3ecca978962013e78f006fdfb299aadbe33d9",
      "expectedRestoredBodyCount": 253,
      "maximumRemainingStubs": 0,
      "minimumStringSiteCoverage": 1.0,
      "maximumMutationCount": 20000,
      "requireOracleParity": true,
      "maximumSurplusMethods": -109,
      "maximumProgramMethodSurplus": 4,
      "maximumSurplusResources": 3,
      "requireOracleResourceParity": true
    },
    {
      "id": "database",
      "tier": "detected",
      "sha256": "be4044e81a4db3af715af05a0c34ebcc7ca909b42469e6b79ea15bbbf68f0c0b",
      "localName": "rsDatabase.protected.dll",
      "expectedDetection": "reactor",
      "expectedCapabilities": ["method-stubs", "jit-hook", "protected-strings", "dispatcher-control-flow", "anti-tamper"],
      "oracleSha256": "482100ea3682a84991de0e02dcce449ecd4bea6495999c1a05c95dd37facbd3d",
      "expectedRestoredBodyCount": 199,
      "maximumRemainingStubs": 0,
      "minimumStringSiteCoverage": 1.0,
      "maximumMutationCount": 20000,
      "requireOracleParity": true,
      "maximumSurplusMethods": -117,
      "maximumProgramMethodSurplus": 8,
      "maximumSurplusResources": 3,
      "requireOracleResourceParity": true
    },
    {
      "id": "qafcakg-payload",
      "tier": "profiled",
      "sha256": "e4e746f968a3ec89027484ab233d3d38c7778458a898d30f31bb74a2c97059d2",
      "localName": "Qafcakg.payload.Ptnifif.dll",
      "expectedDetection": "reactor",
      "expectedCapabilities": ["method-stubs", "jit-hook", "dispatcher-control-flow", "anti-tamper", "resource-container"],
      "oracleSha256": null,
      "expectedRestoredBodyCount": 313,
      "maximumRemainingStubs": 0,
      "maximumMutationCount": 20000,
      "maximumUnreachableInstructions": 0,
      "minimumRecoveredStringSites": 153,
      "expectUnsupportedReason": "No payload could be recovered by interpreting the module's own unpacker."
    },
    {
      "id": "mlfhntkcvb-payload",
      "tier": "detected",
      "sha256": "81cf796c987dbffeb950e38d7e4bc01e85bec2ef4b5a9750d9642843f8460c2a",
      "localName": "Mlfhntkcvb.payload.Lqcuzgc.dll",
      "expectedDetection": "reactor",
      "expectedCapabilities": ["delegate-proxy", "protected-strings", "resource-container", "dispatcher-control-flow", "virtualization"],
      "oracleSha256": null,
      "maximumRemainingStubs": 0,
      "minimumStringSiteCoverage": 1.0,
      "minimumTokensRestored": 13,
      "maximumMutationCount": 20132,
      "minimumVirtualOperationsRead": 0.999,
      "minimumVirtualOperationsWalked": 0.998,
      "requireConsistentVirtualStack": true,
      "expectUnsupportedReason": "No payload could be recovered by interpreting the module's own unpacker."
    },
    {
      "id": "rrdsk-payload",
      "tier": "profiled",
      "sha256": "bf3f63c70625003090603f53dddd5160e9fa32b0eb233e509d166c219846ada9",
      "localName": "Rrdsk.payload.Ktjtiuwiixd.dll",
      "expectedDetection": "reactor",
      "expectedCapabilities": ["dispatcher-control-flow", "protected-strings", "resource-container"],
      "oracleSha256": null,
      "maximumRemainingStubs": 0,
      "minimumStringSiteCoverage": 1.0,
      "minimumTokensRestored": 44,
      "minimumRecoveredStringSites": 178,
      "maximumMutationCount": 20000,
      "expectUnsupportedReason": "No payload could be recovered by interpreting the module's own unpacker."
    },
    {
      "id": "windowsmanagement-bootstrap",
      "tier": "exploratory",
      "sha256": "094dbed0af6664af52375a711e0b8e4e8e7e66c6d47390e8263b16efba4d1995",
      "localName": "WindowsManagement.exe",
      "expectedDetection": "reactor-bootstrap",
      "expectedCapabilities": [],
      "oracleSha256": null,
      "expectedPayloadSha256": ["83ba5d833eba38f578eb8478f8961a0bddb63ff35016b40d8e0536b164ee1ed3"]
    },
    {
      "id": "reason-pac-oracle",
      "tier": "negative",
      "sha256": "82d2b678896ebb388c4ef9ea877e898d1ac2907d956deec4035faddda847dec0",
      "localName": "Reason.PAC.oracle.dll",
      "expectedDetection": "none",
      "expectedCapabilities": [],
      "oracleSha256": null
    },
    {
      "id": "service-controller-oracle",
      "tier": "negative",
      "sha256": "6cdf18c01fe19595d44022a587b3ecca978962013e78f006fdfb299aadbe33d9",
      "localName": "rsServiceController.oracle.dll",
      "expectedDetection": "none",
      "expectedCapabilities": [],
      "oracleSha256": null
    },
    {
      "id": "database-oracle",
      "tier": "negative",
      "sha256": "482100ea3682a84991de0e02dcce449ecd4bea6495999c1a05c95dd37facbd3d",
      "localName": "rsDatabase.oracle.dll",
      "expectedDetection": "none",
      "expectedCapabilities": [],
      "oracleSha256": null
    }
  ]
}
