{
  "manifestVersion": 1,
  "profile": "dotfuscator-7-resource-interactions",
  "description": "Source-built Dotfuscator 7.9 resource-encryption probes across net48/net8.0/net10.0; neutral/fr/fr-CA resources with high control flow, renaming and managed v1/native v2 strings. Companion hashes and renamed resource identities are pinned in provenance.",
  "samples": [
    {
      "id": "net48-resource-oracle",
      "tier": "oracle",
      "sha256": "5e15986a5bae45452f778c40dc386918a718f109f1efe6c9af9c79792faeb96d",
      "localName": "dotfuscator-resource-interactions/net48/oracle/SatelliteProbe.exe",
      "expectedDetection": "none",
      "expectedCapabilities": []
    },
    {
      "id": "net48-flow",
      "tier": "detected",
      "sha256": "c1ce305642417e63426c04880b990e1a061bd5f23debdd1d0930662e06c2932d",
      "localName": "dotfuscator-resource-interactions/net48-flow/protected/SatelliteProbe.exe",
      "expectedDetection": "dotfuscator",
      "expectedCapabilities": [],
      "oracleSha256": "5e15986a5bae45452f778c40dc386918a718f109f1efe6c9af9c79792faeb96d",
      "requireOracleResourceParity": true,
      "minimumResourcesRestored": 3,
      "maximumRemainingSwitchDispatchers": 0,
      "maximumUnreachableInstructions": 0
    },
    {
      "id": "net48-renamed-v1",
      "tier": "detected",
      "sha256": "a76821fd1a596bc66c882aea9b854127ea3320aa493df29a5c82b0b1389dbeca",
      "localName": "dotfuscator-resource-interactions/net48-renamed-v1/protected/SatelliteProbe.exe",
      "expectedDetection": "dotfuscator",
      "expectedCapabilities": [],
      "oracleSha256": "5e15986a5bae45452f778c40dc386918a718f109f1efe6c9af9c79792faeb96d",
      "requireOracleResourceParity": false,
      "minimumResourcesRestored": 3,
      "maximumRemainingSwitchDispatchers": 0,
      "maximumUnreachableInstructions": 0,
      "minimumRecoveredStringSites": 12
    },
    {
      "id": "net48-renamed-v2-reviewed",
      "tier": "detected",
      "sha256": "5f6e9d9af21faaac38a16f66371e3f97aa50ed430ab8e8972aaa20f669765e15",
      "localName": "dotfuscator-resource-interactions/net48-renamed-v2-reviewed/protected/SatelliteProbe.exe",
      "expectedDetection": "dotfuscator",
      "expectedCapabilities": [],
      "oracleSha256": "5e15986a5bae45452f778c40dc386918a718f109f1efe6c9af9c79792faeb96d",
      "requireOracleResourceParity": false,
      "minimumResourcesRestored": 3,
      "maximumRemainingSwitchDispatchers": 0,
      "maximumUnreachableInstructions": 0,
      "minimumRecoveredStringSites": 11
    },
    {
      "id": "net8.0-resource-oracle",
      "tier": "oracle",
      "sha256": "f8f4f58c70bc0dab4a2894c79ec39ac3e319f4ca412c8525e61319d79a89cdc8",
      "localName": "dotfuscator-resource-interactions/net8.0/oracle/SatelliteProbe.dll",
      "expectedDetection": "none",
      "expectedCapabilities": []
    },
    {
      "id": "net8.0-flow",
      "tier": "detected",
      "sha256": "5e039d44552d5c64009aca1ae1082c040ba5190861031038030fa41d386780db",
      "localName": "dotfuscator-resource-interactions/net8.0-flow/protected/SatelliteProbe.dll",
      "expectedDetection": "dotfuscator",
      "expectedCapabilities": [],
      "oracleSha256": "f8f4f58c70bc0dab4a2894c79ec39ac3e319f4ca412c8525e61319d79a89cdc8",
      "requireOracleResourceParity": true,
      "minimumResourcesRestored": 3,
      "maximumRemainingSwitchDispatchers": 0,
      "maximumUnreachableInstructions": 0
    },
    {
      "id": "net8.0-renamed-v1",
      "tier": "detected",
      "sha256": "97c36d6184135500a88616b177434b53efef1ce080e417f46fc91ba9b97839df",
      "localName": "dotfuscator-resource-interactions/net8.0-renamed-v1/protected/SatelliteProbe.dll",
      "expectedDetection": "dotfuscator",
      "expectedCapabilities": [],
      "oracleSha256": "f8f4f58c70bc0dab4a2894c79ec39ac3e319f4ca412c8525e61319d79a89cdc8",
      "requireOracleResourceParity": false,
      "minimumResourcesRestored": 3,
      "maximumRemainingSwitchDispatchers": 0,
      "maximumUnreachableInstructions": 0,
      "minimumRecoveredStringSites": 12
    },
    {
      "id": "net8.0-renamed-v2-reviewed",
      "tier": "detected",
      "sha256": "10c2c4be7bc6dc28b69108a3e7285fe2b06ef7eefe2bbe135f0a484ab21e1a57",
      "localName": "dotfuscator-resource-interactions/net8.0-renamed-v2-reviewed/protected/SatelliteProbe.dll",
      "expectedDetection": "dotfuscator",
      "expectedCapabilities": [],
      "oracleSha256": "f8f4f58c70bc0dab4a2894c79ec39ac3e319f4ca412c8525e61319d79a89cdc8",
      "requireOracleResourceParity": false,
      "minimumResourcesRestored": 3,
      "maximumRemainingSwitchDispatchers": 0,
      "maximumUnreachableInstructions": 0,
      "minimumRecoveredStringSites": 11
    },
    {
      "id": "net10.0-resource-oracle",
      "tier": "oracle",
      "sha256": "76ef9bfd7387ef70e49871c552e26d666515b869e89c3cd040099860472734a4",
      "localName": "dotfuscator-resource-interactions/net10.0/oracle/SatelliteProbe.dll",
      "expectedDetection": "none",
      "expectedCapabilities": []
    },
    {
      "id": "net10.0-flow",
      "tier": "detected",
      "sha256": "b6ccae36842be303ec2abc76b2951d7cb5a86889162bfb63979078a31c053353",
      "localName": "dotfuscator-resource-interactions/net10.0-flow/protected/SatelliteProbe.dll",
      "expectedDetection": "dotfuscator",
      "expectedCapabilities": [],
      "oracleSha256": "76ef9bfd7387ef70e49871c552e26d666515b869e89c3cd040099860472734a4",
      "requireOracleResourceParity": true,
      "minimumResourcesRestored": 3,
      "maximumRemainingSwitchDispatchers": 0,
      "maximumUnreachableInstructions": 0
    },
    {
      "id": "net10.0-renamed-v1",
      "tier": "detected",
      "sha256": "9e7a30430903ebe778142a8104c8242df59ee23ee17c2b2fb15b9a951ac9329c",
      "localName": "dotfuscator-resource-interactions/net10.0-renamed-v1/protected/SatelliteProbe.dll",
      "expectedDetection": "dotfuscator",
      "expectedCapabilities": [],
      "oracleSha256": "76ef9bfd7387ef70e49871c552e26d666515b869e89c3cd040099860472734a4",
      "requireOracleResourceParity": false,
      "minimumResourcesRestored": 3,
      "maximumRemainingSwitchDispatchers": 0,
      "maximumUnreachableInstructions": 0,
      "minimumRecoveredStringSites": 12
    },
    {
      "id": "net10.0-renamed-v2-reviewed",
      "tier": "detected",
      "sha256": "f271f109caecc244bc83dde39a997e22bc93d9d2d85fc680fab48ba1f601d9ab",
      "localName": "dotfuscator-resource-interactions/net10.0-renamed-v2-reviewed/protected/SatelliteProbe.dll",
      "expectedDetection": "dotfuscator",
      "expectedCapabilities": [],
      "oracleSha256": "76ef9bfd7387ef70e49871c552e26d666515b869e89c3cd040099860472734a4",
      "requireOracleResourceParity": false,
      "minimumResourcesRestored": 3,
      "maximumRemainingSwitchDispatchers": 0,
      "maximumUnreachableInstructions": 0,
      "minimumRecoveredStringSites": 11
    }
  ]
}
