{
  "manifestVersion": 1,
  "profile": "dotfuscator-7-check-interactions",
  "description": "Source-built Dotfuscator 7.9 debugging/integrity check probes across net48/net8.0/net10.0. The Basic matrix covers notification sinks and responses; Mixed combines both checks with high control flow, renaming and managed v1/native v2 strings. Default execution matches the source oracle; notification-mode execution matches protected behavior, including injected callback effects.",
  "samples": [
    {
      "id": "net48-check-oracle",
      "tier": "oracle",
      "sha256": "3e83be22e853bb6d3ce7227bed5ace467623c3d59c89a9b9a2d88c5c0c9285a2",
      "localName": "dotfuscator-checks/net48-oracle/CheckProbe.exe",
      "expectedDetection": "none",
      "expectedCapabilities": []
    },
    {
      "id": "net48-combined-flow",
      "tier": "detected",
      "sha256": "fa653e5e6cdf23b3027e57ead14b105a38cfe69badc726204c77f1d94e159e6c",
      "localName": "dotfuscator-checks/net48-combined-flow/CheckProbe.exe",
      "expectedDetection": "dotfuscator",
      "expectedCapabilities": [],
      "oracleSha256": "3e83be22e853bb6d3ce7227bed5ace467623c3d59c89a9b9a2d88c5c0c9285a2",
      "requireOracleResourceParity": true,
      "minimumNeutralizedCheckSites": 2,
      "maximumRemainingSwitchDispatchers": 0,
      "maximumUnreachableInstructions": 0
    },
    {
      "id": "net48-combined-renamed",
      "tier": "detected",
      "sha256": "97fcadd071f491f648a84449a774eb526040b001d9c4eab58c4ce0f8b51604c9",
      "localName": "dotfuscator-checks/net48-combined-renamed/CheckProbe.exe",
      "expectedDetection": "dotfuscator",
      "expectedCapabilities": [],
      "oracleSha256": "3e83be22e853bb6d3ce7227bed5ace467623c3d59c89a9b9a2d88c5c0c9285a2",
      "requireOracleResourceParity": true,
      "minimumNeutralizedCheckSites": 2,
      "maximumRemainingSwitchDispatchers": 0,
      "maximumUnreachableInstructions": 0,
      "minimumRecoveredStringSites": 4
    },
    {
      "id": "net48-combined-native",
      "tier": "detected",
      "sha256": "6b9cf7ef1204948da2b40aee50ac48d955a7dedb2574e0188163bc5014000034",
      "localName": "dotfuscator-checks/net48-combined-native/CheckProbe.exe",
      "expectedDetection": "dotfuscator",
      "expectedCapabilities": [],
      "oracleSha256": "3e83be22e853bb6d3ce7227bed5ace467623c3d59c89a9b9a2d88c5c0c9285a2",
      "requireOracleResourceParity": true,
      "minimumNeutralizedCheckSites": 2,
      "maximumRemainingSwitchDispatchers": 0,
      "maximumUnreachableInstructions": 0,
      "minimumRecoveredStringSites": 4
    },
    {
      "id": "net8.0-check-oracle",
      "tier": "oracle",
      "sha256": "fd7499fbd9ee0cd4ee63244bb37de069f26ca6021b5cf43596e045724b5c6721",
      "localName": "dotfuscator-checks/net8.0-oracle/CheckProbe.dll",
      "expectedDetection": "none",
      "expectedCapabilities": []
    },
    {
      "id": "net8.0-combined-flow",
      "tier": "detected",
      "sha256": "92fd584476ddd807d418a466f81221f4b7ecb5b5251e77c9e1e41317c58d503b",
      "localName": "dotfuscator-checks/net8.0-combined-flow/CheckProbe.dll",
      "expectedDetection": "dotfuscator",
      "expectedCapabilities": [],
      "oracleSha256": "fd7499fbd9ee0cd4ee63244bb37de069f26ca6021b5cf43596e045724b5c6721",
      "requireOracleResourceParity": true,
      "minimumNeutralizedCheckSites": 2,
      "maximumRemainingSwitchDispatchers": 0,
      "maximumUnreachableInstructions": 0
    },
    {
      "id": "net8.0-combined-renamed",
      "tier": "detected",
      "sha256": "eec97d0b27d5d1761b9eba1855878b3f26072440491bff456ab0ec1b6a0ddded",
      "localName": "dotfuscator-checks/net8.0-combined-renamed/CheckProbe.dll",
      "expectedDetection": "dotfuscator",
      "expectedCapabilities": [],
      "oracleSha256": "fd7499fbd9ee0cd4ee63244bb37de069f26ca6021b5cf43596e045724b5c6721",
      "requireOracleResourceParity": true,
      "minimumNeutralizedCheckSites": 2,
      "maximumRemainingSwitchDispatchers": 0,
      "maximumUnreachableInstructions": 0,
      "minimumRecoveredStringSites": 4
    },
    {
      "id": "net8.0-combined-native",
      "tier": "detected",
      "sha256": "b4fd187f97fe92bd424d3ccd242406b557ae7247611c55f0e20cc6595e2fa696",
      "localName": "dotfuscator-checks/net8.0-combined-native/CheckProbe.dll",
      "expectedDetection": "dotfuscator",
      "expectedCapabilities": [],
      "oracleSha256": "fd7499fbd9ee0cd4ee63244bb37de069f26ca6021b5cf43596e045724b5c6721",
      "requireOracleResourceParity": true,
      "minimumNeutralizedCheckSites": 2,
      "maximumRemainingSwitchDispatchers": 0,
      "maximumUnreachableInstructions": 0,
      "minimumRecoveredStringSites": 4
    },
    {
      "id": "net10.0-check-oracle",
      "tier": "oracle",
      "sha256": "9717055ba484593be3e6f591c4bb8af712da666ab287171aff56d8a7ab46dff5",
      "localName": "dotfuscator-checks/net10.0-oracle/CheckProbe.dll",
      "expectedDetection": "none",
      "expectedCapabilities": []
    },
    {
      "id": "net10.0-combined-flow",
      "tier": "detected",
      "sha256": "783d423a75592ff601f33807a38fa9d9efd53856b94ffc17b0c7c3a149c27909",
      "localName": "dotfuscator-checks/net10.0-combined-flow/CheckProbe.dll",
      "expectedDetection": "dotfuscator",
      "expectedCapabilities": [],
      "oracleSha256": "9717055ba484593be3e6f591c4bb8af712da666ab287171aff56d8a7ab46dff5",
      "requireOracleResourceParity": true,
      "minimumNeutralizedCheckSites": 2,
      "maximumRemainingSwitchDispatchers": 0,
      "maximumUnreachableInstructions": 0
    },
    {
      "id": "net10.0-combined-renamed",
      "tier": "detected",
      "sha256": "568289dee4bb74228313ccc9376315f451862620d7e656f82fd950021fbefe4a",
      "localName": "dotfuscator-checks/net10.0-combined-renamed/CheckProbe.dll",
      "expectedDetection": "dotfuscator",
      "expectedCapabilities": [],
      "oracleSha256": "9717055ba484593be3e6f591c4bb8af712da666ab287171aff56d8a7ab46dff5",
      "requireOracleResourceParity": true,
      "minimumNeutralizedCheckSites": 2,
      "maximumRemainingSwitchDispatchers": 0,
      "maximumUnreachableInstructions": 0,
      "minimumRecoveredStringSites": 4
    },
    {
      "id": "net10.0-combined-native",
      "tier": "detected",
      "sha256": "42f732c35b60eb8b65b9fe9136212c38630c4843a9c22537f87d6c12cbb5f4ed",
      "localName": "dotfuscator-checks/net10.0-combined-native/CheckProbe.dll",
      "expectedDetection": "dotfuscator",
      "expectedCapabilities": [],
      "oracleSha256": "9717055ba484593be3e6f591c4bb8af712da666ab287171aff56d8a7ab46dff5",
      "requireOracleResourceParity": true,
      "minimumNeutralizedCheckSites": 2,
      "maximumRemainingSwitchDispatchers": 0,
      "maximumUnreachableInstructions": 0,
      "minimumRecoveredStringSites": 4
    }
  ]
}
