{
  "manifestVersion": 1,
  "profile": "babel-12-password",
  "description": "Three licensed Babel 12.1 password-protected internal method-code captures with source-built oracles. PBKDF2-HMAC-SHA1, AES method-image recovery, exception/finally behavior and zero remaining encrypted method stubs. External code sources remain separate pending work.",
  "samples": [
    {
      "id": "net48-oracle",
      "tier": "oracle",
      "sha256": "c17ce8aa0b2a0f7047f96644c4efdff3f622bb9acc914683a0fafb8410e628ed",
      "localName": "babel-12-password/net48-password/oracle/BabelCodeSources.exe",
      "expectedDetection": "none",
      "expectedCapabilities": []
    },
    {
      "id": "net48-password",
      "tier": "profiled",
      "sha256": "20e8d6cd5b57ecc43cb338324d0decf81e1b810b3e897c4dc4f5fc0b3fe1a2d4",
      "localName": "babel-12-password/net48-password/protected/BabelCodeSources.exe",
      "expectedDetection": "babel",
      "expectedCapabilities": [],
      "oracleSha256": "c17ce8aa0b2a0f7047f96644c4efdff3f622bb9acc914683a0fafb8410e628ed",
      "expectedRestoredBodyCount": 1,
      "maximumRemainingStubs": 0,
      "maximumRemainingSwitchDispatchers": 0,
      "maximumUnreachableInstructions": 0,
      "maximumSurplusResources": 0,
      "requireOracleResourceParity": true,
      "expectedRetiredResourceNames": [
        "Pkkin"
      ]
    },
    {
      "id": "net8.0-oracle",
      "tier": "oracle",
      "sha256": "acb4b172413a92886ecb14f4e218538a446dfcbed0d2ef1e09c3a8ab5326761c",
      "localName": "babel-12-password/net8.0-password/oracle/BabelCodeSources.dll",
      "expectedDetection": "none",
      "expectedCapabilities": []
    },
    {
      "id": "net8.0-password",
      "tier": "profiled",
      "sha256": "b93e036472825f78b3232047223bcaa9083754ba0b46096f8ef603af77458ff7",
      "localName": "babel-12-password/net8.0-password/protected/BabelCodeSources.dll",
      "expectedDetection": "babel",
      "expectedCapabilities": [],
      "oracleSha256": "acb4b172413a92886ecb14f4e218538a446dfcbed0d2ef1e09c3a8ab5326761c",
      "expectedRestoredBodyCount": 1,
      "maximumRemainingStubs": 0,
      "maximumRemainingSwitchDispatchers": 0,
      "maximumUnreachableInstructions": 0,
      "maximumSurplusResources": 0,
      "requireOracleResourceParity": true,
      "expectedRetiredResourceNames": [
        "NIYt"
      ]
    },
    {
      "id": "net10.0-oracle",
      "tier": "oracle",
      "sha256": "0a46ae5b0e0d51aa122e287ef252972ca18cdcc344c39584387cddab485f177f",
      "localName": "babel-12-password/net10.0-password/oracle/BabelCodeSources.dll",
      "expectedDetection": "none",
      "expectedCapabilities": []
    },
    {
      "id": "net10.0-password",
      "tier": "profiled",
      "sha256": "c86b1c951fca9fcef5e3e2b52f9561ce4b2d3fa0ccace783f894967df686d289",
      "localName": "babel-12-password/net10.0-password/protected/BabelCodeSources.dll",
      "expectedDetection": "babel",
      "expectedCapabilities": [],
      "oracleSha256": "0a46ae5b0e0d51aa122e287ef252972ca18cdcc344c39584387cddab485f177f",
      "expectedRestoredBodyCount": 1,
      "maximumRemainingStubs": 0,
      "maximumRemainingSwitchDispatchers": 0,
      "maximumUnreachableInstructions": 0,
      "maximumSurplusResources": 0,
      "requireOracleResourceParity": true,
      "expectedRetiredResourceNames": [
        "NIYt"
      ]
    }
  ]
}
